$ tcpdump -c 20 -i eth0 tcp

tcpdump: verbose output suppressed, use -v or -vv for full protocol decode
listening on eth0, link-type EN10MB (Ethernet), capture size 262144 bytes
19:00:12.550371 IP lampDropletComp3134W2020.ssh > 198.96.84.204.54548: Flags [P.], seq 2762717001:2762717109, ack 1494585803, win 313, length 108
19:00:12.550505 IP lampDropletComp3134W2020.ssh > 198.96.84.204.54548: Flags [P.], seq 108:144, ack 1, win 313, length 36
19:00:12.550607 IP lampDropletComp3134W2020.ssh > 198.96.84.204.54548: Flags [P.], seq 144:252, ack 1, win 313, length 108
19:00:12.550682 IP lampDropletComp3134W2020.ssh > 198.96.84.204.54548: Flags [P.], seq 252:288, ack 1, win 313, length 36
19:00:12.552659 IP 198.96.84.204.54548 > lampDropletComp3134W2020.ssh: Flags [.], ack 108, win 8205, length 0
19:00:12.552916 IP 198.96.84.204.54548 > lampDropletComp3134W2020.ssh: Flags [.], ack 288, win 8204, length 0
19:00:12.553107 IP lampDropletComp3134W2020.ssh > 198.96.84.204.54548: Flags [P.], seq 288:468, ack 1, win 313, length 180
19:00:12.553400 IP lampDropletComp3134W2020.ssh > 198.96.84.204.54548: Flags [P.], seq 504:660, ack 1, win 313, length 156
19:00:12.553671 IP lampDropletComp3134W2020.ssh > 198.96.84.204.54548: Flags [P.], seq 696:852, ack 1, win 313, length 156
19:00:12.553909 IP lampDropletComp3134W2020.ssh > 198.96.84.204.54548: Flags [P.], seq 888:1044, ack 1, win 313, length 156
19:00:12.554350 IP lampDropletComp3134W2020.ssh > 198.96.84.204.54548: Flags [P.], seq 1080:1228, ack 1, win 313, length 148
19:00:12.554900 IP 198.96.84.204.54548 > lampDropletComp3134W2020.ssh: Flags [.], ack 468, win 8203, length 0
19:00:12.554939 IP lampDropletComp3134W2020.ssh > 198.96.84.204.54548: Flags [P.], seq 1264:1604, ack 1, win 313, length 340
19:00:12.556588 IP 198.96.84.204.54548 > lampDropletComp3134W2020.ssh: Flags [.], ack 696, win 8202, length 0
19:00:12.556644 IP lampDropletComp3134W2020.ssh > 198.96.84.204.54548: Flags [P.], seq 1640:2808, ack 1, win 313, length 1168
19:00:12.556790 IP 198.96.84.204.54548 > lampDropletComp3134W2020.ssh: Flags [.], ack 1264, win 8206, length 0
19:00:12.556914 IP lampDropletComp3134W2020.ssh > 198.96.84.204.54548: Flags [P.], seq 2808:2956, ack 1, win 313, length 148
19:00:12.557038 IP lampDropletComp3134W2020.ssh > 198.96.84.204.54548: Flags [P.], seq 2956:2992, ack 1, win 313, length 36
19:00:12.557187 IP lampDropletComp3134W2020.ssh > 198.96.84.204.54548: Flags [P.], seq 2992:3156, ack 1, win 313, length 164
19:00:12.557286 IP lampDropletComp3134W2020.ssh > 198.96.84.204.54548: Flags [P.], seq 3156:3192, ack 1, win 313, length 36
20 packets captured
37 packets received by filter
11 packets dropped by kernel
