$ tcpdump -c 20 -n -i eth0

tcpdump: verbose output suppressed, use -v or -vv for full protocol decode
listening on eth0, link-type EN10MB (Ethernet), capture size 262144 bytes
18:59:33.690729 IP 165.227.32.8.22 > 198.96.84.204.54548: Flags [P.], seq 2762711889:2762711997, ack 1494585007, win 313, length 108
18:59:33.690865 IP 165.227.32.8.22 > 198.96.84.204.54548: Flags [P.], seq 108:144, ack 1, win 313, length 36
18:59:33.690959 IP 165.227.32.8.22 > 198.96.84.204.54548: Flags [P.], seq 144:252, ack 1, win 313, length 108
18:59:33.691105 IP 165.227.32.8.22 > 198.96.84.204.54548: Flags [P.], seq 252:288, ack 1, win 313, length 36
18:59:33.691413 IP 165.227.32.8.22 > 198.96.84.204.54548: Flags [P.], seq 288:460, ack 1, win 313, length 172
18:59:33.691566 IP 165.227.32.8.22 > 198.96.84.204.54548: Flags [P.], seq 460:496, ack 1, win 313, length 36
18:59:33.691738 IP 165.227.32.8.22 > 198.96.84.204.54548: Flags [P.], seq 496:644, ack 1, win 313, length 148
18:59:33.691878 IP 165.227.32.8.22 > 198.96.84.204.54548: Flags [P.], seq 644:680, ack 1, win 313, length 36
18:59:33.692039 IP 165.227.32.8.22 > 198.96.84.204.54548: Flags [P.], seq 680:828, ack 1, win 313, length 148
18:59:33.693027 IP 198.96.84.204.54548 > 165.227.32.8.22: Flags [.], ack 108, win 8206, length 0
18:59:33.693070 IP 165.227.32.8.22 > 198.96.84.204.54548: Flags [P.], seq 828:1784, ack 1, win 313, length 956
18:59:33.693181 IP 165.227.32.8.22 > 198.96.84.204.54548: Flags [P.], seq 1784:1932, ack 1, win 313, length 148
18:59:33.693258 IP 165.227.32.8.22 > 198.96.84.204.54548: Flags [P.], seq 1932:1968, ack 1, win 313, length 36
18:59:33.693420 IP 165.227.32.8.22 > 198.96.84.204.54548: Flags [P.], seq 1968:2100, ack 1, win 313, length 132
18:59:33.695932 IP 198.96.84.204.54548 > 165.227.32.8.22: Flags [.], ack 252, win 8205, length 0
18:59:33.695996 IP 165.227.32.8.22 > 198.96.84.204.54548: Flags [P.], seq 2100:2872, ack 1, win 313, length 772
18:59:33.696040 IP 198.96.84.204.54548 > 165.227.32.8.22: Flags [.], ack 460, win 8204, length 0
18:59:33.696359 IP 165.227.32.8.22 > 198.96.84.204.54548: Flags [P.], seq 2872:3004, ack 1, win 313, length 132
18:59:33.696497 IP 165.227.32.8.22 > 198.96.84.204.54548: Flags [P.], seq 3004:3040, ack 1, win 313, length 36
18:59:33.696614 IP 165.227.32.8.22 > 198.96.84.204.54548: Flags [P.], seq 3040:3188, ack 1, win 313, length 148
20 packets captured
29 packets received by filter
3 packets dropped by kernel
