$ tcpdump -c 20 -i eth0

tcpdump: verbose output suppressed, use -v or -vv for full protocol decode
listening on eth0, link-type EN10MB (Ethernet), capture size 262144 bytes
18:45:13.618312 IP lampDropletComp3134W2020.ssh > 198.96.84.204.54548: Flags [P.], seq 2752192377:2752192485, ack 1494575435, win 313, length 108
18:45:13.618407 IP lampDropletComp3134W2020.ssh > 198.96.84.204.54548: Flags [P.], seq 108:144, ack 1, win 313, length 36
18:45:13.618872 IP lampDropletComp3134W2020.ssh > 198.96.84.204.54548: Flags [P.], seq 144:252, ack 1, win 313, length 108
18:45:13.618979 IP lampDropletComp3134W2020.ssh > 198.96.84.204.54548: Flags [P.], seq 252:288, ack 1, win 313, length 36
18:45:13.620904 IP lampDropletComp3134W2020.ssh > 198.96.84.204.54548: Flags [P.], seq 288:468, ack 1, win 313, length 180
18:45:13.620996 IP lampDropletComp3134W2020.ssh > 198.96.84.204.54548: Flags [P.], seq 468:504, ack 1, win 313, length 36
18:45:13.621117 IP lampDropletComp3134W2020.ssh > 198.96.84.204.54548: Flags [P.], seq 504:660, ack 1, win 313, length 156
18:45:13.621202 IP lampDropletComp3134W2020.ssh > 198.96.84.204.54548: Flags [P.], seq 660:696, ack 1, win 313, length 36
18:45:13.621308 IP lampDropletComp3134W2020.ssh > 198.96.84.204.54548: Flags [P.], seq 696:852, ack 1, win 313, length 156
18:45:13.690908 IP 198.96.84.204.54548 > lampDropletComp3134W2020.ssh: Flags [.], ack 108, win 4103, length 0
18:45:13.691006 IP lampDropletComp3134W2020.ssh > 198.96.84.204.54548: Flags [P.], seq 852:2040, ack 1, win 313, length 1188
18:45:13.691035 IP 198.96.84.204.54548 > lampDropletComp3134W2020.ssh: Flags [.], ack 252, win 4102, length 0
18:45:13.691046 IP 198.96.84.204.54548 > lampDropletComp3134W2020.ssh: Flags [.], ack 468, win 4101, length 0
18:45:13.691053 IP 198.96.84.204.54548 > lampDropletComp3134W2020.ssh: Flags [.], ack 660, win 4100, length 0
18:45:13.691060 IP 198.96.84.204.54548 > lampDropletComp3134W2020.ssh: Flags [.], ack 852, win 4100, length 0
18:45:13.691267 IP lampDropletComp3134W2020.ssh > 198.96.84.204.54548: Flags [P.], seq 2040:2188, ack 1, win 313, length 148
18:45:13.691433 IP lampDropletComp3134W2020.ssh > 198.96.84.204.54548: Flags [P.], seq 2224:2388, ack 1, win 313, length 164
18:45:13.691599 IP lampDropletComp3134W2020.ssh > 198.96.84.204.54548: Flags [P.], seq 2424:2572, ack 1, win 313, length 148
18:45:13.691744 IP lampDropletComp3134W2020.ssh > 198.96.84.204.54548: Flags [P.], seq 2608:2756, ack 1, win 313, length 148
18:45:13.691887 IP lampDropletComp3134W2020.ssh > 198.96.84.204.54548: Flags [P.], seq 2792:2940, ack 1, win 313, length 148
20 packets captured
34 packets received by filter
9 packets dropped by kernel
