$ tcpdump -c 10 -i eth0 src 165.227.32.8

tcpdump: verbose output suppressed, use -v or -vv for full protocol decode
listening on eth0, link-type EN10MB (Ethernet), capture size 262144 bytes
19:06:49.685605 IP lampDropletComp3134W2020.ssh > 198.96.84.204.54548: Flags [P.], seq 2762734105:2762734213, ack 1494591895, win 313, length 108
19:06:49.685723 IP lampDropletComp3134W2020.ssh > 198.96.84.204.54548: Flags [P.], seq 108:144, ack 1, win 313, length 36
19:06:49.685819 IP lampDropletComp3134W2020.ssh > 198.96.84.204.54548: Flags [P.], seq 144:252, ack 1, win 313, length 108
19:06:49.685895 IP lampDropletComp3134W2020.ssh > 198.96.84.204.54548: Flags [P.], seq 252:288, ack 1, win 313, length 36
19:06:49.688213 IP lampDropletComp3134W2020.ssh > 198.96.84.204.54548: Flags [P.], seq 288:468, ack 1, win 313, length 180
19:06:49.688305 IP lampDropletComp3134W2020.ssh > 198.96.84.204.54548: Flags [P.], seq 468:504, ack 1, win 313, length 36
19:06:49.688416 IP lampDropletComp3134W2020.ssh > 198.96.84.204.54548: Flags [P.], seq 504:660, ack 1, win 313, length 156
19:06:49.688493 IP lampDropletComp3134W2020.ssh > 198.96.84.204.54548: Flags [P.], seq 660:696, ack 1, win 313, length 36
19:06:49.688599 IP lampDropletComp3134W2020.ssh > 198.96.84.204.54548: Flags [P.], seq 696:852, ack 1, win 313, length 156
19:06:49.693618 IP lampDropletComp3134W2020.ssh > 198.96.84.204.54548: Flags [P.], seq 852:2040, ack 1, win 313, length 1188
10 packets captured
12 packets received by filter
0 packets dropped by kernel
