& tcpdump -c 20 -i eth0 port 22

tcpdump: verbose output suppressed, use -v or -vv for full protocol decode
listening on eth0, link-type EN10MB (Ethernet), capture size 262144 bytes
19:01:03.542570 IP lampDropletComp3134W2020.ssh > 198.96.84.204.54548: Flags [P.], seq 2762722489:2762722597, ack 1494586775, win 313, length 108
19:01:03.542752 IP lampDropletComp3134W2020.ssh > 198.96.84.204.54548: Flags [P.], seq 108:144, ack 1, win 313, length 36
19:01:03.542933 IP lampDropletComp3134W2020.ssh > 198.96.84.204.54548: Flags [P.], seq 144:252, ack 1, win 313, length 108
19:01:03.543068 IP lampDropletComp3134W2020.ssh > 198.96.84.204.54548: Flags [P.], seq 252:288, ack 1, win 313, length 36
19:01:03.545352 IP 198.96.84.204.54548 > lampDropletComp3134W2020.ssh: Flags [.], ack 108, win 8206, length 0
19:01:03.545703 IP 198.96.84.204.54548 > lampDropletComp3134W2020.ssh: Flags [.], ack 288, win 8205, length 0
19:01:03.546125 IP lampDropletComp3134W2020.ssh > 198.96.84.204.54548: Flags [P.], seq 288:468, ack 1, win 313, length 180
19:01:03.546449 IP lampDropletComp3134W2020.ssh > 198.96.84.204.54548: Flags [P.], seq 504:660, ack 1, win 313, length 156
19:01:03.546724 IP lampDropletComp3134W2020.ssh > 198.96.84.204.54548: Flags [P.], seq 696:852, ack 1, win 313, length 156
19:01:03.547062 IP lampDropletComp3134W2020.ssh > 198.96.84.204.54548: Flags [P.], seq 888:1044, ack 1, win 313, length 156
19:01:03.547350 IP lampDropletComp3134W2020.ssh > 198.96.84.204.54548: Flags [P.], seq 1080:1228, ack 1, win 313, length 148
19:01:03.550620 IP 198.96.84.204.54548 > lampDropletComp3134W2020.ssh: Flags [.], ack 468, win 8204, length 0
19:01:03.550672 IP lampDropletComp3134W2020.ssh > 198.96.84.204.54548: Flags [P.], seq 1264:2424, ack 1, win 313, length 1160
19:01:03.550908 IP lampDropletComp3134W2020.ssh > 198.96.84.204.54548: Flags [P.], seq 2424:2572, ack 1, win 313, length 148
19:01:03.553703 IP 198.96.84.204.54548 > lampDropletComp3134W2020.ssh: Flags [.], ack 1264, win 8201, length 0
19:01:03.553760 IP lampDropletComp3134W2020.ssh > 198.96.84.204.54548: Flags [P.], seq 2572:3008, ack 1, win 313, length 436
19:01:03.554034 IP lampDropletComp3134W2020.ssh > 198.96.84.204.54548: Flags [P.], seq 3008:3156, ack 1, win 313, length 148
19:01:03.554133 IP lampDropletComp3134W2020.ssh > 198.96.84.204.54548: Flags [P.], seq 3156:3192, ack 1, win 313, length 36
19:01:03.554259 IP lampDropletComp3134W2020.ssh > 198.96.84.204.54548: Flags [P.], seq 3192:3356, ack 1, win 313, length 164
19:01:03.554370 IP lampDropletComp3134W2020.ssh > 198.96.84.204.54548: Flags [P.], seq 3356:3392, ack 1, win 313, length 36
20 packets captured
33 packets received by filter
7 packets dropped by kernel
