$  tcpdump -i eth0

...(too long to paste entire output)
18:42:22.300140 IP lampDropletComp3134W2020.ssh > 198.96.84.204.54548: Flags [P.], seq 154904:155076, ack 73, win 313, length 172
18:42:22.300284 IP lampDropletComp3134W2020.ssh > 198.96.84.204.54548: Flags [P.], seq 155076:155248, ack 73, win 313, length 172
18:42:22.300440 IP lampDropletComp3134W2020.ssh > 198.96.84.204.54548: Flags [P.], seq 155248:155420, ack 73, win 313, length 172
18:42:22.300569 IP lampDropletComp3134W2020.ssh > 198.96.84.204.54548: Flags [P.], seq 155420:155592, ack 73, win 313, length 172
18:42:22.300694 IP lampDropletComp3134W2020.ssh > 198.96.84.204.54548: Flags [P.], seq 155592:155764, ack 73, win 313, length 172
18:42:22.300833 IP lampDropletComp3134W2020.ssh > 198.96.84.204.54548: Flags [P.], seq 155764:155936, ack 73, win 313, length 172
18:42:22.300972 IP lampDropletComp3134W2020.ssh > 198.96.84.204.54548: Flags [P.], seq 155936:156108, ack 73, win 313, length 172
18:42:22.301120 IP lampDropletComp3134W2020.ssh > 198.96.84.204.54548: Flags [P.], seq 156108:156280, ack 73, win 313, length 172
18:42:22.301270 IP lampDropletComp3134W2020.ssh > 198.96.84.204.54548: Flags [P.], seq 156280:156452, ack 73, win 313, length 172
18:42:22.301388 IP lampDropletComp3134W2020.ssh > 198.96.84.204.54548: Flags [P.], seq 156452:156624, ack 73, win 313, length 172
18:42:22.301540 IP lampDropletComp3134W2020.ssh > 198.96.84.204.54548: Flags [P.], seq 156624:156796, ack 73, win 313, length 172
18:42:22.301699 IP lampDropletComp3134W2020.ssh > 198.96.84.204.54548: Flags [P.], seq 156796:156968, ack 73, win 313, length 172
18:42:22.301847 IP lampDropletComp3134W2020.ssh > 198.96.84.204.54548: Flags [P.], seq 156968:157140, ack 73, win 313, length 172
18:42:22.301983 IP lampDropletComp3134W2020.ssh > 198.96.84.204.54548: Flags [P.], seq 157140:157312, ack 73, win 313, length 172
18:42:22.302132 IP lampDropletComp3134W2020.ssh > 198.96.84.204.54548: Flags [P.], seq 157312:157484, ack 73, win 313, length 172
18:42:22.302274 IP lampDropletComp3134W2020.ssh > 198.96.84.204.54548: Flags [P.], seq 157484:157656, ack 73, win 313, length 172
18:42:22.302415 IP lampDropletComp3134W2020.ssh > 198.96.84.204.54548: Flags [P.], seq 157656:157828, ack 73, win 313, length 172
18:42:22.302567 IP lampDropletComp3134W2020.ssh > 198.96.84.204.54548: Flags [P.], seq 157828:158000, ack 73, win 313, length 172
18:42:22.302729 IP lampDropletComp3134W2020.ssh > 198.96.84.204.54548: Flags [P.], seq 158000:158172, ack 73, win 313, length 172
18:42:22.302873 IP lampDropletComp3134W2020.ssh > 198.96.84.204.54548: Flags [P.], seq 158172:158344, ack 73, win 313, length 172
18:42:22.303061 IP lampDropletComp3134W2020.ssh > 198.96.84.204.54548: Flags [P.], seq 158344:158516, ack 73, win 313, length 172
18:42:22.303217 IP lampDropletComp3134W2020.ssh > 198.96.84.204.54548: Flags [P.], seq 158516:158688, ack 73, win 313, length 172
18:42:22.303330 IP lampDropletComp3134W2020.ssh > 198.96.84.204.54548: Flags [P.], seq 158688:158860, ack 73, win 313, length 172
18:42:22.303475 IP lampDropletComp3134W2020.ssh > 198.96.84.204.54548: Flags [P.], seq 158860:159032, ack 73, win 313, length 172
18:42:22.303628 IP lampDropletComp3134W2020.ssh > 198.96.84.204.54548: Flags [P.], seq 159032:159204, ack 73, win 313, length 172
18:42:22.303781 IP lampDropletComp3134W2020.ssh > 198.96.84.204.54548: Flags [P.], seq 159204:159376, ack 73, win 313, length 172
18:42:22.303926 IP lampDropletComp3134W2020.ssh > 198.96.84.204.54548: Flags [P.], seq 159376:159548, ack 73, win 313, length 172
18:42:22.304029 IP lampDropletComp3134W2020.ssh > 198.96.84.204.54548: Flags [P.], seq 159548:159720, ack 73, win 313, length 172
18:42:22.304157 IP lampDropletComp3134W2020.ssh > 198.96.84.204.54548: Flags [P.], seq 159720:159892, ack 73, win 313, length 172
18:42:22.304262 IP lampDropletComp3134W2020.ssh > 198.96.84.204.54548: Flags [P.], seq 159892:160064, ack 73, win 313, length 172
18:42:22.304354 IP lampDropletComp3134W2020.ssh > 198.96.84.204.54548: Flags [P.], seq 160064:160236, ack 73, win 313, length 172
18:42:22.304477 IP lampDropletComp3134W2020.ssh > 198.96.84.204.54548: Flags [P.], seq 160236:160408, ack 73, win 313, length 172
18:42:22.304596 IP lampDropletComp3134W2020.ssh > 198.96.84.204.54548: Flags [P.], seq 160408:160580, ack 73, win 313, length 172
18:42:22.304698 IP lampDropletComp3134W2020.ssh > 198.96.84.204.54548: Flags [P.], seq 160580:160752, ack 73, win 313, length 172
18:42:22.304789 IP lampDropletComp3134W2020.ssh > 198.96.84.204.54548: Flags [P.], seq 160752:160924, ack 73, win 313, length 172
18:42:22.304878 IP lampDropletComp3134W2020.ssh > 198.96.84.204.54548: Flags [P.], seq 160924:161096, ack 73, win 313, length 172
18:42:22.304970 IP lampDropletComp3134W2020.ssh > 198.96.84.204.54548: Flags [P.], seq 161096:161268, ack 73, win 313, length 172
18:42:22.305060 IP lampDropletComp3134W2020.ssh > 198.96.84.204.54548: Flags [P.], seq 161268:161440, ack 73, win 313, length 172
18:42:22.305151 IP lampDropletComp3134W2020.ssh > 198.96.84.204.54548: Flags [P.], seq 161440:161612, ack 73, win 313, length 172
18:42:22.305240 IP lampDropletComp3134W2020.ssh > 198.96.84.204.54548: Flags [P.], seq 161612:161784, ack 73, win 313, length 172
18:42:22.305329 IP lampDropletComp3134W2020.ssh > 198.96.84.204.54548: Flags [P.], seq 161784:161956, ack 73, win 313, length 172
18:42:22.305436 IP lampDropletComp3134W2020.ssh > 198.96.84.204.54548: Flags [P.], seq 161956:162128, ack 73, win 313, length 172
18:42:22.305547 IP lampDropletComp3134W2020.ssh > 198.96.84.204.54548: Flags [P.], seq 162128:162300, ack 73, win 313, length 172
18:42:22.305651 IP lampDropletComp3134W2020.ssh > 198.96.84.204.54548: Flags [P.], seq 162300:162472, ack 73, win 313, length 172
18:42:22.305747 IP lampDropletComp3134W2020.ssh > 198.96.84.204.54548: Flags [P.], seq 162472:162644, ack 73, win 313, length 172
18:42:22.305836 IP lampDropletComp3134W2020.ssh > 198.96.84.204.54548: Flags [P.], seq 162644:162816, ack 73, win 313, length 172
18:42:22.305966 IP lampDropletComp3134W2020.ssh > 198.96.84.204.54548: Flags [P.], seq 162816:162988, ack 73, win 313, length 172
18:42:22.306116 IP lampDropletComp3134W2020.ssh > 198.96.84.204.54548: Flags [P.], seq 162988:163160, ack 73, win 313, length 172
18:42:22.306220 IP lampDropletComp3134W2020.ssh > 198.96.84.204.54548: Flags [P.], seq 163160:163332, ack 73, win 313, length 172
18:42:22.306334 IP lampDropletComp3134W2020.ssh > 198.96.84.204.54548: Flags [P.], seq 163332:163504, ack 73, win 313, length 172
18:42:22.306478 IP lampDropletComp3134W2020.ssh > 198.96.84.204.54548: Flags [P.], seq 163504:163676, ack 73, win 313, length 172
18:42:22.306586 IP lampDropletComp3134W2020.ssh > 198.96.84.204.54548: Flags [P.], seq 163676:163848, ack 73, win 313, length 172
18:42:22.306696 IP lampDropletComp3134W2020.ssh > 198.96.84.204.54548: Flags [P.], seq 163848:164020, ack 73, win 313, length 172
18:42:22.306851 IP lampDropletComp3134W2020.ssh > 198.96.84.204.54548: Flags [P.], seq 164020:164192, ack 73, win 313, length 172
18:42:22.307033 IP lampDropletComp3134W2020.ssh > 198.96.84.204.54548: Flags [P.], seq 164192:164364, ack 73, win 313, length 172
18:42:22.307185 IP lampDropletComp3134W2020.ssh > 198.96.84.204.54548: Flags [P.], seq 164364:164536, ack 73, win 313, length 172
18:42:22.307347 IP lampDropletComp3134W2020.ssh > 198.96.84.204.54548: Flags [P.], seq 164536:164708, ack 73, win 313, length 172
18:42:22.307501 IP lampDropletComp3134W2020.ssh > 198.96.84.204.54548: Flags [P.], seq 164708:164880, ack 73, win 313, length 172
18:42:22.307658 IP lampDropletComp3134W2020.ssh > 198.96.84.204.54548: Flags [P.], seq 164880:165052, ack 73, win 313, length 172
18:42:22.307803 IP lampDropletComp3134W2020.ssh > 198.96.84.204.54548: Flags [P.], seq 165052:165224, ack 73, win 313, length 172
18:42:22.307970 IP lampDropletComp3134W2020.ssh > 198.96.84.204.54548: Flags [P.], seq 165224:165396, ack 73, win 313, length 172
18:42:22.308149 IP lampDropletComp3134W2020.ssh > 198.96.84.204.54548: Flags [P.], seq 165396:165568, ack 73, win 313, length 172
18:42:22.308283 IP lampDropletComp3134W2020.ssh > 198.96.84.204.54548: Flags [P.], seq 165568:165740, ack 73, win 313, length 172
18:42:22.308441 IP lampDropletComp3134W2020.ssh > 198.96.84.204.54548: Flags [P.], seq 165740:165912, ack 73, win 313, length 172
18:42:22.308564 IP lampDropletComp3134W2020.ssh > 198.96.84.204.54548: Flags [P.], seq 165912:166084, ack 73, win 313, length 172
18:42:22.308711 IP lampDropletComp3134W2020.ssh > 198.96.84.204.54548: Flags [P.], seq 166084:166256, ack 73, win 313, length 172
18:42:22.308864 IP lampDropletComp3134W2020.ssh > 198.96.84.204.54548: Flags [P.], seq 166256:166428, ack 73, win 313, length 172
18:42:22.308979 IP lampDropletComp3134W2020.ssh > 198.96.84.204.54548: Flags [P.], seq 166428:166600, ack 73, win 313, length 172
18:42:22.309086 IP lampDropletComp3134W2020.ssh > 198.96.84.204.54548: Flags [P.], seq 166600:166772, ack 73, win 313, length 172
18:42:22.309228 IP lampDropletComp3134W2020.ssh > 198.96.84.204.54548: Flags [P.], seq 166772:166944, ack 73, win 313, length 172
18:42:22.309366 IP lampDropletComp3134W2020.ssh > 198.96.84.204.54548: Flags [P.], seq 166944:167116, ack 73, win 313, length 172
18:42:22.309529 IP lampDropletComp3134W2020.ssh > 198.96.84.204.54548: Flags [P.], seq 167116:167288, ack 73, win 313, length 172
18:42:22.309687 IP lampDropletComp3134W2020.ssh > 198.96.84.204.54548: Flags [P.], seq 167288:167460, ack 73, win 313, length 172
18:42:22.309847 IP lampDropletComp3134W2020.ssh > 198.96.84.204.54548: Flags [P.], seq 167460:167632, ack 73, win 313, length 172
18:42:22.309992 IP lampDropletComp3134W2020.ssh > 198.96.84.204.54548: Flags [P.], seq 167632:167804, ack 73, win 313, length 172
18:42:22.310145 IP lampDropletComp3134W2020.ssh > 198.96.84.204.54548: Flags [P.], seq 167804:167976, ack 73, win 313, length 172
18:42:22.310306 IP lampDropletComp3134W2020.ssh > 198.96.84.204.54548: Flags [P.], seq 167976:168148, ack 73, win 313, length 172
18:42:22.310479 IP lampDropletComp3134W2020.ssh > 198.96.84.204.54548: Flags [P.], seq 168148:168320, ack 73, win 313, length 172
18:42:22.310588 IP lampDropletComp3134W2020.ssh > 198.96.84.204.54548: Flags [P.], seq 168320:168492, ack 73, win 313, length 172
18:42:22.310659 IP 198.96.84.204.54548 > lampDropletComp3134W2020.ssh: Flags [.], ack 156280, win 4103, length 0
18:42:22.310819 IP lampDropletComp3134W2020.ssh > 198.96.84.204.54548: Flags [P.], seq 168492:168776, ack 73, win 313, length 284
18:42:22.311003 IP lampDropletComp3134W2020.ssh > 198.96.84.204.54548: Flags [P.], seq 168776:168948, ack 73, win 313, length 172
18:42:22.311138 IP lampDropletComp3134W2020.ssh > 198.96.84.204.54548: Flags [P.], seq 168948:169120, ack 73, win 313, length 172
18:42:22.311262 IP lampDropletComp3134W2020.ssh > 198.96.84.204.54548: Flags [P.], seq 169120:169292, ack 73, win 313, length 172
18:42:22.311414 IP lampDropletComp3134W2020.ssh > 198.96.84.204.54548: Flags [P.], seq 169292:169464, ack 73, win 313, length 172
18:42:22.311573 IP lampDropletComp3134W2020.ssh > 198.96.84.204.54548: Flags [P.], seq 169464:169636, ack 73, win 313, length 172
18:42:22.311688 IP lampDropletComp3134W2020.ssh > 198.96.84.204.54548: Flags [P.], seq 169636:169808, ack 73, win 313, length 172
18:42:22.311781 IP lampDropletComp3134W2020.ssh > 198.96.84.204.54548: Flags [P.], seq 169808:169980, ack 73, win 313, length 172
18:42:22.311901 IP lampDropletComp3134W2020.ssh > 198.96.84.204.54548: Flags [P.], seq 169980:170152, ack 73, win 313, length 172
18:42:22.312051 IP lampDropletComp3134W2020.ssh > 198.96.84.204.54548: Flags [P.], seq 170152:170324, ack 73, win 313, length 172
18:42:22.312185 IP lampDropletComp3134W2020.ssh > 198.96.84.204.54548: Flags [P.], seq 170324:170496, ack 73, win 313, length 172
18:42:22.312287 IP 198.96.84.204.54548 > lampDropletComp3134W2020.ssh: Flags [.], ack 157828, win 4103, length 0
18:42:22.312318 IP 198.96.84.204.54548 > lampDropletComp3134W2020.ssh: Flags [P.], seq 73:109, ack 157828, win 4103, length 36
18:42:22.312475 IP lampDropletComp3134W2020.ssh > 198.96.84.204.54548: Flags [P.], seq 170496:170668, ack 109, win 313, length 172
18:42:22.312590 IP lampDropletComp3134W2020.ssh > 198.96.84.204.54548: Flags [P.], seq 170668:170944, ack 109, win 313, length 276
18:42:22.312676 IP lampDropletComp3134W2020.ssh > 198.96.84.204.54548: Flags [P.], seq 170944:171116, ack 109, win 313, length 172
18:42:22.312764 IP lampDropletComp3134W2020.ssh > 198.96.84.204.54548: Flags [P.], seq 171116:171288, ack 109, win 313, length 172
18:42:22.312902 IP lampDropletComp3134W2020.ssh > 198.96.84.204.54548: Flags [P.], seq 171288:171460, ack 109, win 313, length 172
18:42:22.312997 IP lampDropletComp3134W2020.ssh > 198.96.84.204.54548: Flags [P.], seq 171460:171632, ack 109, win 313, length 172
18:42:22.313109 IP lampDropletComp3134W2020.ssh > 198.96.84.204.54548: Flags [P.], seq 171632:171804, ack 109, win 313, length 172
18:42:22.313222 IP lampDropletComp3134W2020.ssh > 198.96.84.204.54548: Flags [P.], seq 171804:171976, ack 109, win 313, length 172
18:42:22.313308 IP lampDropletComp3134W2020.ssh > 198.96.84.204.54548: Flags [P.], seq 171976:172148, ack 109, win 313, length 172
18:42:22.313394 IP lampDropletComp3134W2020.ssh > 198.96.84.204.54548: Flags [P.], seq 172148:172320, ack 109, win 313, length 172
18:42:22.313558 IP lampDropletComp3134W2020.ssh > 198.96.84.204.54548: Flags [P.], seq 172320:172492, ack 109, win 313, length 172
18:42:22.313695 IP lampDropletComp3134W2020.ssh > 198.96.84.204.54548: Flags [P.], seq 172492:172664, ack 109, win 313, length 172
18:42:22.313787 IP lampDropletComp3134W2020.ssh > 198.96.84.204.54548: Flags [P.], seq 172664:172836, ack 109, win 313, length 172
18:42:22.313890 IP lampDropletComp3134W2020.ssh > 198.96.84.204.54548: Flags [P.], seq 172836:173008, ack 109, win 313, length 172
18:42:22.314049 IP lampDropletComp3134W2020.ssh > 198.96.84.204.54548: Flags [P.], seq 173008:173180, ack 109, win 313, length 172
18:42:22.314227 IP lampDropletComp3134W2020.ssh > 198.96.84.204.54548: Flags [P.], seq 173180:173352, ack 109, win 313, length 172
18:42:22.314383 IP lampDropletComp3134W2020.ssh > 198.96.84.204.54548: Flags [P.], seq 173352:173524, ack 109, win 313, length 172
18:42:22.314534 IP lampDropletComp3134W2020.ssh > 198.96.84.204.54548: Flags [P.], seq 173524:173696, ack 109, win 313, length 172
18:42:22.314689 IP lampDropletComp3134W2020.ssh > 198.96.84.204.54548: Flags [P.], seq 173696:173868, ack 109, win 313, length 172
18:42:22.314807 IP lampDropletComp3134W2020.ssh > 198.96.84.204.54548: Flags [P.], seq 173868:174040, ack 109, win 313, length 172
18:42:22.314957 IP lampDropletComp3134W2020.ssh > 198.96.84.204.54548: Flags [P.], seq 174040:174212, ack 109, win 313, length 172
18:42:22.315082 IP lampDropletComp3134W2020.ssh > 198.96.84.204.54548: Flags [P.], seq 174212:174384, ack 109, win 313, length 172
18:42:22.315208 IP lampDropletComp3134W2020.ssh > 198.96.84.204.54548: Flags [P.], seq 174384:174556, ack 109, win 313, length 172
18:42:22.315334 IP lampDropletComp3134W2020.ssh > 198.96.84.204.54548: Flags [P.], seq 174556:174728, ack 109, win 313, length 172
18:42:22.315434 IP lampDropletComp3134W2020.ssh > 198.96.84.204.54548: Flags [P.], seq 174728:174900, ack 109, win 313, length 172
18:42:22.315524 IP lampDropletComp3134W2020.ssh > 198.96.84.204.54548: Flags [P.], seq 174900:175072, ack 109, win 313, length 172
18:42:22.315609 IP lampDropletComp3134W2020.ssh > 198.96.84.204.54548: Flags [P.], seq 175072:175244, ack 109, win 313, length 172
18:42:22.315692 IP lampDropletComp3134W2020.ssh > 198.96.84.204.54548: Flags [P.], seq 175244:175416, ack 109, win 313, length 172
18:42:22.315786 IP lampDropletComp3134W2020.ssh > 198.96.84.204.54548: Flags [P.], seq 175416:175588, ack 109, win 313, length 172
18:42:22.315880 IP lampDropletComp3134W2020.ssh > 198.96.84.204.54548: Flags [P.], seq 175588:175760, ack 109, win 313, length 172
18:42:22.316002 IP lampDropletComp3134W2020.ssh > 198.96.84.204.54548: Flags [P.], seq 175760:175932, ack 109, win 313, length 172
18:42:22.316165 IP lampDropletComp3134W2020.ssh > 198.96.84.204.54548: Flags [P.], seq 175932:176104, ack 109, win 313, length 172
18:42:22.316292 IP lampDropletComp3134W2020.ssh > 198.96.84.204.54548: Flags [P.], seq 176104:176276, ack 109, win 313, length 172
18:42:22.316414 IP lampDropletComp3134W2020.ssh > 198.96.84.204.54548: Flags [P.], seq 176276:176448, ack 109, win 313, length 172
18:42:22.316553 IP lampDropletComp3134W2020.ssh > 198.96.84.204.54548: Flags [P.], seq 176448:176620, ack 109, win 313, length 172
18:42:22.321524 IP 198.96.84.204.54548 > lampDropletComp3134W2020.ssh: Flags [.], ack 159720, win 4103, length 0
18:42:22.321604 IP lampDropletComp3134W2020.ssh > 198.96.84.204.54548: Flags [P.], seq 176620:176964, ack 109, win 313, length 344
18:42:22.321798 IP lampDropletComp3134W2020.ssh > 198.96.84.204.54548: Flags [P.], seq 176964:177248, ack 109, win 313, length 284
18:42:22.321923 IP lampDropletComp3134W2020.ssh > 198.96.84.204.54548: Flags [P.], seq 177248:177420, ack 109, win 313, length 172
18:42:22.322042 IP lampDropletComp3134W2020.ssh > 198.96.84.204.54548: Flags [P.], seq 177420:177592, ack 109, win 313, length 172
18:42:22.322160 IP lampDropletComp3134W2020.ssh > 198.96.84.204.54548: Flags [P.], seq 177592:177764, ack 109, win 313, length 172
18:42:22.322280 IP lampDropletComp3134W2020.ssh > 198.96.84.204.54548: Flags [P.], seq 177764:177936, ack 109, win 313, length 172
18:42:22.322394 IP lampDropletComp3134W2020.ssh > 198.96.84.204.54548: Flags [P.], seq 177936:178108, ack 109, win 313, length 172
18:42:22.322504 IP lampDropletComp3134W2020.ssh > 198.96.84.204.54548: Flags [P.], seq 178108:178280, ack 109, win 313, length 172
18:42:22.322614 IP lampDropletComp3134W2020.ssh > 198.96.84.204.54548: Flags [P.], seq 178280:178452, ack 109, win 313, length 172
18:42:22.322721 IP lampDropletComp3134W2020.ssh > 198.96.84.204.54548: Flags [P.], seq 178452:178624, ack 109, win 313, length 172
18:42:22.322831 IP lampDropletComp3134W2020.ssh > 198.96.84.204.54548: Flags [P.], seq 178624:178796, ack 109, win 313, length 172
18:42:22.322971 IP lampDropletComp3134W2020.ssh > 198.96.84.204.54548: Flags [P.], seq 178796:178968, ack 109, win 313, length 172
18:42:22.329231 IP 198.96.84.204.54548 > lampDropletComp3134W2020.ssh: Flags [.], ack 160580, win 4099, length 0
18:42:22.329276 IP lampDropletComp3134W2020.ssh > 198.96.84.204.54548: Flags [P.], seq 178968:179140, ack 109, win 313, length 172
18:42:22.329447 IP lampDropletComp3134W2020.ssh > 198.96.84.204.54548: Flags [P.], seq 179140:179424, ack 109, win 313, length 284
18:42:22.329539 IP lampDropletComp3134W2020.ssh > 198.96.84.204.54548: Flags [P.], seq 179424:179596, ack 109, win 313, length 172
18:42:22.329623 IP lampDropletComp3134W2020.ssh > 198.96.84.204.54548: Flags [P.], seq 179596:179768, ack 109, win 313, length 172
18:42:22.329699 IP lampDropletComp3134W2020.ssh > 198.96.84.204.54548: Flags [P.], seq 179768:179940, ack 109, win 313, length 172
18:42:22.336161 IP 198.96.84.204.54548 > lampDropletComp3134W2020.ssh: Flags [.], ack 162472, win 4103, length 0
18:42:22.336216 IP lampDropletComp3134W2020.ssh > 198.96.84.204.54548: Flags [P.], seq 179940:180112, ack 109, win 313, length 172
18:42:22.336244 IP 198.96.84.204.54548 > lampDropletComp3134W2020.ssh: Flags [.], ack 164364, win 4103, length 0
18:42:22.336269 IP 198.96.84.204.54548 > lampDropletComp3134W2020.ssh: Flags [.], ack 166256, win 4103, length 0
18:42:22.336602 IP lampDropletComp3134W2020.ssh > 198.96.84.204.54548: Flags [P.], seq 180112:180620, ack 109, win 313, length 508
18:42:22.336647 IP 198.96.84.204.54548 > lampDropletComp3134W2020.ssh: Flags [.], ack 168148, win 4103, length 0
18:42:22.336658 IP 198.96.84.204.54548 > lampDropletComp3134W2020.ssh: Flags [.], ack 169120, win 4099, length 0
18:42:22.336889 IP lampDropletComp3134W2020.ssh > 198.96.84.204.54548: Flags [P.], seq 180620:181016, ack 109, win 313, length 396
18:42:22.337050 IP lampDropletComp3134W2020.ssh > 198.96.84.204.54548: Flags [P.], seq 181016:181188, ack 109, win 313, length 172
18:42:22.337182 IP lampDropletComp3134W2020.ssh > 198.96.84.204.54548: Flags [P.], seq 181188:181360, ack 109, win 313, length 172
18:42:22.337296 IP lampDropletComp3134W2020.ssh > 198.96.84.204.54548: Flags [P.], seq 181360:181532, ack 109, win 313, length 172
18:42:22.337442 IP lampDropletComp3134W2020.ssh > 198.96.84.204.54548: Flags [P.], seq 181532:181704, ack 109, win 313, length 172
18:42:22.337578 IP lampDropletComp3134W2020.ssh > 198.96.84.204.54548: Flags [P.], seq 181704:181876, ack 109, win 313, length 172
18:42:22.337728 IP lampDropletComp3134W2020.ssh > 198.96.84.204.54548: Flags [P.], seq 181876:182048, ack 109, win 313, length 172
18:42:22.337869 IP lampDropletComp3134W2020.ssh > 198.96.84.204.54548: Flags [P.], seq 182048:182220, ack 109, win 313, length 172
18:42:22.337999 IP lampDropletComp3134W2020.ssh > 198.96.84.204.54548: Flags [P.], seq 182220:182392, ack 109, win 313, length 172
18:42:22.338156 IP lampDropletComp3134W2020.ssh > 198.96.84.204.54548: Flags [P.], seq 182392:182564, ack 109, win 313, length 172
18:42:22.338296 IP lampDropletComp3134W2020.ssh > 198.96.84.204.54548: Flags [P.], seq 182564:182736, ack 109, win 313, length 172
18:42:22.338404 IP lampDropletComp3134W2020.ssh > 198.96.84.204.54548: Flags [P.], seq 182736:182908, ack 109, win 313, length 172
18:42:22.338508 IP lampDropletComp3134W2020.ssh > 198.96.84.204.54548: Flags [P.], seq 182908:183080, ack 109, win 313, length 172
18:42:22.338610 IP lampDropletComp3134W2020.ssh > 198.96.84.204.54548: Flags [P.], seq 183080:183252, ack 109, win 313, length 172
18:42:22.338713 IP lampDropletComp3134W2020.ssh > 198.96.84.204.54548: Flags [P.], seq 183252:183424, ack 109, win 313, length 172
18:42:22.338814 IP lampDropletComp3134W2020.ssh > 198.96.84.204.54548: Flags [P.], seq 183424:183596, ack 109, win 313, length 172
18:42:22.338958 IP lampDropletComp3134W2020.ssh > 198.96.84.204.54548: Flags [P.], seq 183596:183768, ack 109, win 313, length 172
18:42:22.339112 IP lampDropletComp3134W2020.ssh > 198.96.84.204.54548: Flags [P.], seq 183768:183940, ack 109, win 313, length 172
18:42:22.339255 IP lampDropletComp3134W2020.ssh > 198.96.84.204.54548: Flags [P.], seq 183940:184112, ack 109, win 313, length 172
18:42:22.339370 IP lampDropletComp3134W2020.ssh > 198.96.84.204.54548: Flags [P.], seq 184112:184284, ack 109, win 313, length 172
18:42:22.339498 IP lampDropletComp3134W2020.ssh > 198.96.84.204.54548: Flags [P.], seq 184284:184456, ack 109, win 313, length 172
18:42:22.339625 IP lampDropletComp3134W2020.ssh > 198.96.84.204.54548: Flags [P.], seq 184456:184628, ack 109, win 313, length 172
18:42:22.339739 IP lampDropletComp3134W2020.ssh > 198.96.84.204.54548: Flags [P.], seq 184628:184800, ack 109, win 313, length 172
18:42:22.339852 IP lampDropletComp3134W2020.ssh > 198.96.84.204.54548: Flags [P.], seq 184800:184972, ack 109, win 313, length 172
18:42:22.339981 IP lampDropletComp3134W2020.ssh > 198.96.84.204.54548: Flags [P.], seq 184972:185144, ack 109, win 313, length 172
18:42:22.340153 IP lampDropletComp3134W2020.ssh > 198.96.84.204.54548: Flags [P.], seq 185144:185316, ack 109, win 313, length 172
18:42:22.340279 IP lampDropletComp3134W2020.ssh > 198.96.84.204.54548: Flags [P.], seq 185316:185488, ack 109, win 313, length 172
18:42:22.340413 IP lampDropletComp3134W2020.ssh > 198.96.84.204.54548: Flags [P.], seq 185488:185660, ack 109, win 313, length 172
18:42:22.340522 IP lampDropletComp3134W2020.ssh > 198.96.84.204.54548: Flags [P.], seq 185660:185832, ack 109, win 313, length 172
18:42:22.340659 IP lampDropletComp3134W2020.ssh > 198.96.84.204.54548: Flags [P.], seq 185832:186004, ack 109, win 313, length 172
18:42:22.340817 IP lampDropletComp3134W2020.ssh > 198.96.84.204.54548: Flags [P.], seq 186004:186176, ack 109, win 313, length 172
18:42:22.340967 IP lampDropletComp3134W2020.ssh > 198.96.84.204.54548: Flags [P.], seq 186176:186348, ack 109, win 313, length 172
18:42:22.341076 IP lampDropletComp3134W2020.ssh > 198.96.84.204.54548: Flags [P.], seq 186348:186520, ack 109, win 313, length 172
18:42:22.341180 IP lampDropletComp3134W2020.ssh > 198.96.84.204.54548: Flags [P.], seq 186520:186692, ack 109, win 313, length 172
18:42:22.341282 IP lampDropletComp3134W2020.ssh > 198.96.84.204.54548: Flags [P.], seq 186692:186864, ack 109, win 313, length 172
18:42:22.341384 IP lampDropletComp3134W2020.ssh > 198.96.84.204.54548: Flags [P.], seq 186864:187036, ack 109, win 313, length 172
18:42:22.341485 IP lampDropletComp3134W2020.ssh > 198.96.84.204.54548: Flags [P.], seq 187036:187208, ack 109, win 313, length 172
18:42:22.341591 IP lampDropletComp3134W2020.ssh > 198.96.84.204.54548: Flags [P.], seq 187208:187380, ack 109, win 313, length 172
18:42:22.341710 IP lampDropletComp3134W2020.ssh > 198.96.84.204.54548: Flags [P.], seq 187380:187552, ack 109, win 313, length 172
18:42:22.341848 IP lampDropletComp3134W2020.ssh > 198.96.84.204.54548: Flags [P.], seq 187552:187724, ack 109, win 313, length 172
18:42:22.341966 IP lampDropletComp3134W2020.ssh > 198.96.84.204.54548: Flags [P.], seq 187724:187896, ack 109, win 313, length 172
18:42:22.342069 IP lampDropletComp3134W2020.ssh > 198.96.84.204.54548: Flags [P.], seq 187896:188068, ack 109, win 313, length 172
18:42:22.342171 IP lampDropletComp3134W2020.ssh > 198.96.84.204.54548: Flags [P.], seq 188068:188240, ack 109, win 313, length 172
18:42:22.342274 IP lampDropletComp3134W2020.ssh > 198.96.84.204.54548: Flags [P.], seq 188240:188412, ack 109, win 313, length 172
18:42:22.342375 IP lampDropletComp3134W2020.ssh > 198.96.84.204.54548: Flags [P.], seq 188412:188584, ack 109, win 313, length 172
18:42:22.342481 IP lampDropletComp3134W2020.ssh > 198.96.84.204.54548: Flags [P.], seq 188584:188756, ack 109, win 313, length 172
18:42:22.342583 IP lampDropletComp3134W2020.ssh > 198.96.84.204.54548: Flags [P.], seq 188756:188928, ack 109, win 313, length 172
18:42:22.342684 IP lampDropletComp3134W2020.ssh > 198.96.84.204.54548: Flags [P.], seq 188928:189100, ack 109, win 313, length 172
18:42:22.342798 IP lampDropletComp3134W2020.ssh > 198.96.84.204.54548: Flags [P.], seq 189100:189272, ack 109, win 313, length 172
18:42:22.344660 IP 198.96.84.204.54548 > lampDropletComp3134W2020.ssh: Flags [.], ack 171116, win 4103, length 0
18:42:22.344715 IP lampDropletComp3134W2020.ssh > 198.96.84.204.54548: Flags [P.], seq 189272:189444, ack 109, win 313, length 172
18:42:22.344734 IP 198.96.84.204.54548 > lampDropletComp3134W2020.ssh: Flags [.], ack 173008, win 4103, length 0
18:42:22.344748 IP 198.96.84.204.54548 > lampDropletComp3134W2020.ssh: Flags [.], ack 174900, win 4103, length 0
18:42:22.344761 IP 198.96.84.204.54548 > lampDropletComp3134W2020.ssh: Flags [.], ack 176964, win 4103, length 0
18:42:22.344772 IP 198.96.84.204.54548 > lampDropletComp3134W2020.ssh: Flags [.], ack 178796, win 4103, length 0
18:42:22.345071 IP lampDropletComp3134W2020.ssh > 198.96.84.204.54548: Flags [P.], seq 189444:190184, ack 109, win 313, length 740
18:42:22.345187 IP lampDropletComp3134W2020.ssh > 198.96.84.204.54548: Flags [P.], seq 190184:190356, ack 109, win 313, length 172
18:42:22.345288 IP lampDropletComp3134W2020.ssh > 198.96.84.204.54548: Flags [P.], seq 190356:190528, ack 109, win 313, length 172
18:42:22.345384 IP lampDropletComp3134W2020.ssh > 198.96.84.204.54548: Flags [P.], seq 190528:190700, ack 109, win 313, length 172
18:42:22.345495 IP lampDropletComp3134W2020.ssh > 198.96.84.204.54548: Flags [P.], seq 190700:190872, ack 109, win 313, length 172
18:42:22.345590 IP lampDropletComp3134W2020.ssh > 198.96.84.204.54548: Flags [P.], seq 190872:191044, ack 109, win 313, length 172
18:42:22.345682 IP lampDropletComp3134W2020.ssh > 198.96.84.204.54548: Flags [P.], seq 191044:191216, ack 109, win 313, length 172
18:42:22.345804 IP lampDropletComp3134W2020.ssh > 198.96.84.204.54548: Flags [P.], seq 191216:191388, ack 109, win 313, length 172
18:42:22.345976 IP lampDropletComp3134W2020.ssh > 198.96.84.204.54548: Flags [P.], seq 191388:191560, ack 109, win 313, length 172
18:42:22.346140 IP lampDropletComp3134W2020.ssh > 198.96.84.204.54548: Flags [P.], seq 191560:191732, ack 109, win 313, length 172
18:42:22.346289 IP lampDropletComp3134W2020.ssh > 198.96.84.204.54548: Flags [P.], seq 191732:191904, ack 109, win 313, length 172
18:42:22.346396 IP lampDropletComp3134W2020.ssh > 198.96.84.204.54548: Flags [P.], seq 191904:192076, ack 109, win 313, length 172
18:42:22.346489 IP lampDropletComp3134W2020.ssh > 198.96.84.204.54548: Flags [P.], seq 192076:192248, ack 109, win 313, length 172
18:42:22.346579 IP lampDropletComp3134W2020.ssh > 198.96.84.204.54548: Flags [P.], seq 192248:192420, ack 109, win 313, length 172
18:42:22.346672 IP lampDropletComp3134W2020.ssh > 198.96.84.204.54548: Flags [P.], seq 192420:192592, ack 109, win 313, length 172
18:42:22.346762 IP lampDropletComp3134W2020.ssh > 198.96.84.204.54548: Flags [P.], seq 192592:192764, ack 109, win 313, length 172
18:42:22.346852 IP lampDropletComp3134W2020.ssh > 198.96.84.204.54548: Flags [P.], seq 192764:192936, ack 109, win 313, length 172
18:42:22.346979 IP lampDropletComp3134W2020.ssh > 198.96.84.204.54548: Flags [P.], seq 192936:193108, ack 109, win 313, length 172
18:42:22.347157 IP lampDropletComp3134W2020.ssh > 198.96.84.204.54548: Flags [P.], seq 193108:193280, ack 109, win 313, length 172
18:42:22.347324 IP lampDropletComp3134W2020.ssh > 198.96.84.204.54548: Flags [P.], seq 193280:193452, ack 109, win 313, length 172
18:42:22.347505 IP lampDropletComp3134W2020.ssh > 198.96.84.204.54548: Flags [P.], seq 193452:193624, ack 109, win 313, length 172
18:42:22.347665 IP lampDropletComp3134W2020.ssh > 198.96.84.204.54548: Flags [P.], seq 193624:193796, ack 109, win 313, length 172
18:42:22.347832 IP lampDropletComp3134W2020.ssh > 198.96.84.204.54548: Flags [P.], seq 193796:193968, ack 109, win 313, length 172
18:42:22.347989 IP lampDropletComp3134W2020.ssh > 198.96.84.204.54548: Flags [P.], seq 193968:194140, ack 109, win 313, length 172
18:42:22.348145 IP lampDropletComp3134W2020.ssh > 198.96.84.204.54548: Flags [P.], seq 194140:194312, ack 109, win 313, length 172
18:42:22.348243 IP lampDropletComp3134W2020.ssh > 198.96.84.204.54548: Flags [P.], seq 194312:194484, ack 109, win 313, length 172
18:42:22.348334 IP lampDropletComp3134W2020.ssh > 198.96.84.204.54548: Flags [P.], seq 194484:194656, ack 109, win 313, length 172
18:42:22.348423 IP lampDropletComp3134W2020.ssh > 198.96.84.204.54548: Flags [P.], seq 194656:194828, ack 109, win 313, length 172
18:42:22.348514 IP lampDropletComp3134W2020.ssh > 198.96.84.204.54548: Flags [P.], seq 194828:195000, ack 109, win 313, length 172
18:42:22.348610 IP lampDropletComp3134W2020.ssh > 198.96.84.204.54548: Flags [P.], seq 195000:195172, ack 109, win 313, length 172
18:42:22.348814 IP lampDropletComp3134W2020.ssh > 198.96.84.204.54548: Flags [P.], seq 195172:195344, ack 109, win 313, length 172
18:42:22.348959 IP lampDropletComp3134W2020.ssh > 198.96.84.204.54548: Flags [P.], seq 195344:195516, ack 109, win 313, length 172
18:42:22.349079 IP lampDropletComp3134W2020.ssh > 198.96.84.204.54548: Flags [P.], seq 195516:195688, ack 109, win 313, length 172
18:42:22.349185 IP lampDropletComp3134W2020.ssh > 198.96.84.204.54548: Flags [P.], seq 195688:195860, ack 109, win 313, length 172
18:42:22.349278 IP lampDropletComp3134W2020.ssh > 198.96.84.204.54548: Flags [P.], seq 195860:196032, ack 109, win 313, length 172
18:42:22.349380 IP lampDropletComp3134W2020.ssh > 198.96.84.204.54548: Flags [P.], seq 196032:196204, ack 109, win 313, length 172
18:42:22.349476 IP lampDropletComp3134W2020.ssh > 198.96.84.204.54548: Flags [P.], seq 196204:196376, ack 109, win 313, length 172
18:42:22.349567 IP lampDropletComp3134W2020.ssh > 198.96.84.204.54548: Flags [P.], seq 196376:196548, ack 109, win 313, length 172
18:42:22.349662 IP lampDropletComp3134W2020.ssh > 198.96.84.204.54548: Flags [P.], seq 196548:196720, ack 109, win 313, length 172
18:42:22.349755 IP lampDropletComp3134W2020.ssh > 198.96.84.204.54548: Flags [P.], seq 196720:196892, ack 109, win 313, length 172
18:42:22.349845 IP lampDropletComp3134W2020.ssh > 198.96.84.204.54548: Flags [P.], seq 196892:197064, ack 109, win 313, length 172
18:42:22.349935 IP lampDropletComp3134W2020.ssh > 198.96.84.204.54548: Flags [P.], seq 197064:197236, ack 109, win 313, length 172
18:42:22.350086 IP lampDropletComp3134W2020.ssh > 198.96.84.204.54548: Flags [P.], seq 197236:197408, ack 109, win 313, length 172
18:42:22.350210 IP lampDropletComp3134W2020.ssh > 198.96.84.204.54548: Flags [P.], seq 197408:197580, ack 109, win 313, length 172
18:42:22.350309 IP lampDropletComp3134W2020.ssh > 198.96.84.204.54548: Flags [P.], seq 197580:197752, ack 109, win 313, length 172
18:42:22.350401 IP lampDropletComp3134W2020.ssh > 198.96.84.204.54548: Flags [P.], seq 197752:197924, ack 109, win 313, length 172
18:42:22.350498 IP lampDropletComp3134W2020.ssh > 198.96.84.204.54548: Flags [P.], seq 197924:198096, ack 109, win 313, length 172
18:42:22.350639 IP lampDropletComp3134W2020.ssh > 198.96.84.204.54548: Flags [P.], seq 198096:198268, ack 109, win 313, length 172
18:42:22.350794 IP lampDropletComp3134W2020.ssh > 198.96.84.204.54548: Flags [P.], seq 198268:198440, ack 109, win 313, length 172
18:42:22.350992 IP lampDropletComp3134W2020.ssh > 198.96.84.204.54548: Flags [P.], seq 198440:198612, ack 109, win 313, length 172
18:42:22.351160 IP lampDropletComp3134W2020.ssh > 198.96.84.204.54548: Flags [P.], seq 198612:198784, ack 109, win 313, length 172
18:42:22.351284 IP lampDropletComp3134W2020.ssh > 198.96.84.204.54548: Flags [P.], seq 198784:198956, ack 109, win 313, length 172
18:42:22.351401 IP lampDropletComp3134W2020.ssh > 198.96.84.204.54548: Flags [P.], seq 198956:199128, ack 109, win 313, length 172
18:42:22.351545 IP lampDropletComp3134W2020.ssh > 198.96.84.204.54548: Flags [P.], seq 199128:199300, ack 109, win 313, length 172
18:42:22.351666 IP lampDropletComp3134W2020.ssh > 198.96.84.204.54548: Flags [P.], seq 199300:199472, ack 109, win 313, length 172
18:42:22.351781 IP lampDropletComp3134W2020.ssh > 198.96.84.204.54548: Flags [P.], seq 199472:199644, ack 109, win 313, length 172
18:42:22.372297 IP 198.96.84.204.54548 > lampDropletComp3134W2020.ssh: Flags [P.], seq 109:145, ack 178796, win 4103, length 36
^C
1213 packets captured
1233 packets received by filter
20 packets dropped by kernel
